{
  "id": "fsar_16a35237-90dc-48a9-a6d7-72017c46590b",
  "timestamp": "2026-01-01T12:43:23.924Z",
  "proposal": "idea_implementation: Create or update the file generated_1.js with this complete content:\n\n-- file: db/migrate/20190730145612_create_customer_data_table.rb\nclass CreateCustomerDataTable < ActiveRecord::Migration[5.2]\n  def change\n    create_table :customer_data do |t|\n      t.string :demographics, null: false\n      t.jsonb :purchasing_history, default: {}, null: true\n      \n      t.timestamps\n    end\n    \n    add_index :customer_data, :demographics, unique: true\n  end\nend\n\nThis is for opportunity: AI-Driven Customer Insights Service\nMake sure the file is complete, working, and production-ready.",
  "severity": 6,
  "risks": [
    "Slow failure: unnoticed degradation accumulating by 2028-01-01",
    "Unintended consequence: incentives shift toward short-term metrics, long-term reliability decays",
    "Incentive drift: stakeholders habituate to optimistic outputs, raising risk of silent defects"
  ],
  "mitigations": [
    "Add scheduled adversarial audits with hard pass/fail gates",
    "Track leading indicators for drift and trust inflation; alert on trend change",
    "Prefer reversible rollouts; keep rollback artifacts warm and tested"
  ],
  "block_execution": false
}