{
  "id": "fsar_7083d4ad-271a-4cfe-825c-23daf0d09e4d",
  "timestamp": "2026-01-02T10:18:10.131Z",
  "proposal": "self_improvement:  To address the issues identified, we need to focus on several key areas within our system: improving database schema, optimizing task execution processes, enhancing performance metrics tracking, and ensuring robust error handling and prevention mechanisms. Here are specific, actionable improvements:\n\n### 1. Database Schema Improvement\nThe persistent issue with `ai_model` column not existing in the `execution_tasks` table suggests a potential mismatch or missing migration during database schema updates. This can be resolved by:\n   - **Creating a Migration Script:** Generate and apply a new migration script to add the `ai_model` column if it was missed during previous migrations.\n   - **Schema Verification:** Implement a routine check at startup or before task execution to verify that all necessary tables and columns exist, alerting administrators in case of discrepancies.\n\n### 2. Task Execution Process Optimization\nThe high duration averages for `implement_idea`, `idea_implementation`, and `self_improvement` tasks indicate significant inefficiencies in these processes. To address this:\n   - **Automate Task Categorization:** Implement machine learning models to automatically categorize tasks based on predefined criteria, reducing the need for manual intervention which often leads to delays.\n   - **Parallel Processing Enhancements:** Leverage asynchronous processing where possible to allow multiple tasks to run concurrently, thereby reducing overall task duration.\n   - **Resource Allocation Adjustment:** Dynamically adjust resource allocation based on task complexity and expected duration, ensuring that simpler tasks are assigned less computationally intensive resources if they don't require high-end AI capabilities.\n\n### 3. Enhancing Performance Metrics Tracking\nTo improve the tracking of performance metrics:\n   - **Automated Logging Improvements:** Implement a more sophisticated logging system that captures detailed timing and resource usage data for each task, allowing for better analysis and performance trend identification.\n   - **Real-Time Monitoring Dashboard:** Develop an interactive dashboard that provides real-time updates on tasks in progress, their status, duration, and any errors encountered. This will not only help monitor current operations but also provide a basis for future optimizations.\n\n### 4. Safety and Ethics Enhancement\nGiven the blind spot detection of 27679, ensuring compliance with safety and ethics is crucial:\n   - **Ethics Scorecard:** Implement a regular ethics assessment process where each AI-generated service or model undergoes a periodic review to ensure alignment with established ethical guidelines.\n   - **User Consent Management:** Strengthen user consent management processes by explicitly requesting permission for data usage, task execution, and any other interactions before proceeding.\n\n### 5. Reducing Friction in Monetization Flows\nTo streamline monetization flows:\n   - **Simplify Payment Processors:** Evaluate current payment gateways (like Stripe) to ensure they are not introducing unnecessary friction during transactions. Consider switching to simpler, less complex processors if needed.\n   - **Automated Revenue Tracking:** Implement automated scripts that regularly check and confirm revenue streams from each service without manual intervention, ensuring accuracy and efficiency in tracking ROI.\n\n### Implementation Strategy\n- **Phase 1: Database Migration** - Begin by creating a migration script to add the missing `ai_model` column. This should be done quickly to prevent further task failures related to this issue.\n- **Phase 2: Task Execution Optimization** - Implement parallel processing enhancements and start developing an automated categorization system for tasks.\n- **Phase 3: Performance Metrics Tracking Improvement** - Develop a real-time monitoring dashboard and enhance logging with detailed timing data.\n- **Phase 4: Safety and Ethics Enhancement** - Begin regular ethics assessments and improve consent management processes.\n- **Phase 5: Monetization Flows Optimization** - Start by simplifying payment processors or switching to more user-friendly options, followed by automated revenue tracking scripts.\n\nThese improvements are designed to not only resolve immediate issues but also enhance the long-term robustness and efficiency of our system across multiple dimensions.",
  "severity": 6,
  "risks": [
    "Slow failure: unnoticed degradation accumulating by 2028-01-02",
    "Unintended consequence: incentives shift toward short-term metrics, long-term reliability decays",
    "Incentive drift: stakeholders habituate to optimistic outputs, raising risk of silent defects"
  ],
  "mitigations": [
    "Add scheduled adversarial audits with hard pass/fail gates",
    "Track leading indicators for drift and trust inflation; alert on trend change",
    "Prefer reversible rollouts; keep rollback artifacts warm and tested"
  ],
  "block_execution": false
}