{
  "id": "fsar_eda0acf9-c890-4a3f-bee0-eb7899bfc8ff",
  "timestamp": "2026-01-01T04:58:20.519Z",
  "proposal": "idea_implementation: Create or update the file auth/routes/index.js with this complete content:\n\n```javascript\nconst express = require('express');\nconst router = new express.Router();\n\nrouter.post('/login', async (req, res) => {\n    // Authentication logic here...\n});\n\nrouter.post('/register', async (req, res) => {\n    // Registration logic here...\n});\n\nmodule.exports = router;\n```\n\nThis is for opportunity: Make.com Automation Scenarios\nMake sure the file is complete, working, and production-ready.",
  "severity": 6,
  "risks": [
    "Slow failure: unnoticed degradation accumulating by 2027-12-31",
    "Unintended consequence: incentives shift toward short-term metrics, long-term reliability decays",
    "Incentive drift: stakeholders habituate to optimistic outputs, raising risk of silent defects"
  ],
  "mitigations": [
    "Add scheduled adversarial audits with hard pass/fail gates",
    "Track leading indicators for drift and trust inflation; alert on trend change",
    "Prefer reversible rollouts; keep rollback artifacts warm and tested"
  ],
  "block_execution": false
}