{
  "id": "fsar_28777157-1274-459c-a8f1-3be409707285",
  "timestamp": "2026-01-01T12:01:19.072Z",
  "proposal": "idea_implementation: Create or update the file generated_2.sql with this complete content:\n\n===FILE:migrations/create_tables.sql===\nCREATE TABLE IF NOT EXISTS customer_profiles (\n    id SERIAL PRIMARY KEY,\n    name VARCHAR(255),\n    contact_information TEXT,\n    preferences JSONB,  -- Assume 'preferences' is a nested structure of service types and related data\n    consent BOOLEAN DEFAULT false,  // Consent to GDPR compliance or privacy regulations flag.\n    last_interaction TIMESTAMP WITH TIME ZONE\n);\nCREATE TABLE IF NOT EXISTS workflows (\n    id SERIAL PRIMARY KEY,\n    customer_id INTEGER REFERENCES customer_profiles(id),  -- Assuming foreign key to the customers table above.\n    preferences JSONB,\n    started_at TIMESTAMP WITH TIME ZONE DEFAULT CURRENT_TIMESTAMP NOT NULL,\n    completed_by VARCHAR(255),\n    status VARCHAR(10) CHECK (status IN ('pending', 'in progress', 'completed'))  -- Status of the workflow.\n);\nCREATE TABLE IF NOT EXISTS financial_transactions (\n    id SERIAL PRIMARY KEY,\n    payment_information JSONB,   -- Assuming this includes reference identifier and transaction ID from Stripe API endpoint integration.\n    amount NUMERIC(10,2),  // Assumed currency is USD for simplicity; adjust based on actual requirements.\n    reference VARCHAR UNIQUE NOT NULL,\n    status VARCHAR CHECK (status IN ('success', 'failed')),   -- Transaction states like pending or failed payments etc.\n    transaction_id TEXT REFERENCES stripe(id) ON DELETE CASCADE  // Assuming Stripe ID as reference; adjust according to actual schema design with API integration details in place for real-time syncing and security practices, including proper handling of access tokens and secure storage.\n);\n\nThis is for opportunity: Instant Service Workflow Design\nMake sure the file is complete, working, and production-ready.",
  "severity": 6,
  "risks": [
    "Slow failure: unnoticed degradation accumulating by 2028-01-01",
    "Unintended consequence: incentives shift toward short-term metrics, long-term reliability decays",
    "Incentive drift: stakeholders habituate to optimistic outputs, raising risk of silent defects"
  ],
  "mitigations": [
    "Add scheduled adversarial audits with hard pass/fail gates",
    "Track leading indicators for drift and trust inflation; alert on trend change",
    "Prefer reversible rollouts; keep rollback artifacts warm and tested"
  ],
  "block_execution": false
}