{
  "id": "fsar_34c474c7-638c-4fc6-ba22-b96412454f63",
  "timestamp": "2026-01-02T14:11:51.903Z",
  "proposal": "idea_implementation: Create or update the file components/dashboard-widgets.js with this complete content:\n\nimport React from 'react';\n// ... other imports and setup code if necessary\n\nconst DashboardWidget = ({ activeTickets, pendingResolutions }) => (\n    <div>\n        {/* Render your widget components here */}\n        <h2>Active Tickets</h2>\n        <ul>\n            {activeTickets.map(ticket => \n                <li key={ticket.id}>{ticket.subject}</li>\n            )}\n        </ul>\n        \n        <h2>Pending Resolutions</h2>\n        <ul>\n            {pendingResolutions.map(resolution => \n                <li key={resolution.id}>{resolution.status}</li>\n            )}\n        </ul>\n    </div>\n);\n\nexport default DashboardWidget;\n\nThis is for opportunity: AI-Enhanced Customer Support System\nMake sure the file is complete, working, and production-ready.",
  "severity": 6,
  "risks": [
    "Slow failure: unnoticed degradation accumulating by 2028-01-02",
    "Unintended consequence: incentives shift toward short-term metrics, long-term reliability decays",
    "Incentive drift: stakeholders habituate to optimistic outputs, raising risk of silent defects"
  ],
  "mitigations": [
    "Add scheduled adversarial audits with hard pass/fail gates",
    "Track leading indicators for drift and trust inflation; alert on trend change",
    "Prefer reversible rollouts; keep rollback artifacts warm and tested"
  ],
  "block_execution": false
}