{
  "id": "fsar_a9c2aad7-5d88-4565-8546-b6828c5d067f",
  "timestamp": "2026-01-01T05:14:01.162Z",
  "proposal": "idea_implementation: Create or update the file generated_4.sql with this complete content:\n\n// Simulated front-end JavaScript structure for a basic revenue logs dashboard, assuming use of 'Chart.js' library; assume proper Bootstrap modal script inclusion if used as the primary user interface element -- assumes correct jQuery dependency loading prior to this script --> \n<script>\n    // Placeholder code block simulating fetching and processing RevenueLogs data from a Rails backend API using AJAX calls, assuming use of Chart.js for visualization:\n    const revenueData = [{\"amount\":100,\"user_email\":\"example@gmail.com\",\"timestamp\":\"2023-04-05T15:09:00Z\"}]; // Simulated sample data array representing logged revenues; in actual implementation, this would be replaced by real AJAX fetch logic to retrieve and process relevant RevenueLogs from the Rails backend API\n    \n    const ctx = document.getElementById('revenueChart').getContext('2d'); // Assuming 'revenueChart' is a canvas element with an id where chart will be rendered; include corresponding Bootstrap modal structure if using as primary UI, ensuring proper accessibility and responsiveness standards are met based on actual application setup -->\n    const revenueChart = new Chart(ctx, {\n        type: 'bar', // Assuming use of Bar charts for simplicity in concept demonstration here -- replace with appropriate chart types or libraries used in the project; ensure customization options like tooltips and axis labels are enabled to display relevant information such as user email associated data points --> \n        data: revenueData,\n        options: { // Simulated configuration object representing various settings for Chart.js visualizations -- assumes correct Bootstrap styling is applied here based on actual project setup requirements; configure additional charting library features or custom styles if required by the specific design needs of your dashboard --> \n            title: 'Revenue Logs',\n            legend: { display: true },\n            elements: { // Simulating bar-based visualization with user email as identifiers for each data point; assume additional configuration settings and charting library features are implemented here based on actual project setup requirements, e.g., dynamic updates from backend API calls --> \n                labels: revenueData.map(log => log.user_email), // Simulated array of unique user emails representing identifiers for each bar in the visualization -- replace with real or fetched data as necessary based on actual project setup requirements; assume correct Bootstrap styling is applied here if using this component within a modal structure --> \n                datasets: [ { label: 'Revenues', backgroundColor: '#3Cb1c2', borderColor: '#3Cb1c2', hoverBackgroundColor: '#50a7d8', data: revenueData.map(log => log.amount) } ] // Simulated dataset representation, assuming use of a charting library like 'Chart.js' for visualization -- replace with real or dynamically fetched data as necessary based on actual project setup requirements; assume additional customizations and configurations are implemented here according to specific design needs --> \n        },\n    });\n    \n</script>\n<!-- Additional frontend JS code related to this dashboard component, ensuring it is placed in the appropriate order within layout structure for correct execution based on actual project setup requirements; assume proper Bootstrap modal or popover functionality integration if used as primary UI element -->\n\nThis is for opportunity: Make.com Scenario Automation\nMake sure the file is complete, working, and production-ready.",
  "severity": 6,
  "risks": [
    "Slow failure: unnoticed degradation accumulating by 2027-12-31",
    "Unintended consequence: incentives shift toward short-term metrics, long-term reliability decays",
    "Incentive drift: stakeholders habituate to optimistic outputs, raising risk of silent defects"
  ],
  "mitigations": [
    "Add scheduled adversarial audits with hard pass/fail gates",
    "Track leading indicators for drift and trust inflation; alert on trend change",
    "Prefer reversible rollouts; keep rollback artifacts warm and tested"
  ],
  "block_execution": false
}