{
  "id": "fsar_79e692ba-9616-429b-ad80-084d4b71ae48",
  "timestamp": "2026-01-02T07:12:53.156Z",
  "proposal": "idea_implementation: Create or update the file generated_1.sql with this complete content:\n\n-- migration file for creating the Reviews table in Neon PostgreSQL database, storing code review information including user reference and source code path among others\nBEGIN; -- Start transaction to ensure data integrity during migrations\nCREATE TABLE IF NOT EXISTS reviews (\n    id SERIAL PRIMARY KEY,\n    user_id INT REFEREN0CES users(id) ON DELETE CASCADE,\n    filepath VARCHAR(256) UNIQUE NOT NULL, -- Path to the source code submitted for review\n    timestamp TIMESTAMP WITH TIME ZONE DEFAULT NOW(), -- Date and time when reviews were requested by developers \n    phi_score FLOAT CHECK (phi_score >= 0 AND phi_score <= 1) NOT NULL, -- Phi-3 Mini's analysis score for the code reviewed\n    status VARCHAR(50), -- Current state of the code review; 'pending', 'reviewing', or 'completed'. Default is 'pending'.\n    FOREIGN KEY (user_id) REFERENCES users(id) ON DELETE CASCADE \n);\nCOMMIT; -- Commit changes to database after table creation.\n\nThis is for opportunity: Automated Code Review Service\nMake sure the file is complete, working, and production-ready.",
  "severity": 6,
  "risks": [
    "Slow failure: unnoticed degradation accumulating by 2028-01-01",
    "Unintended consequence: incentives shift toward short-term metrics, long-term reliability decays",
    "Incentive drift: stakeholders habituate to optimistic outputs, raising risk of silent defects"
  ],
  "mitigations": [
    "Add scheduled adversarial audits with hard pass/fail gates",
    "Track leading indicators for drift and trust inflation; alert on trend change",
    "Prefer reversible rollouts; keep rollback artifacts warm and tested"
  ],
  "block_execution": false
}