{
  "id": "fsar_5cbe7517-02ed-487d-8284-502a23355c36",
  "timestamp": "2026-01-01T19:11:51.668Z",
  "proposal": "idea_implementation: Create or update the file generated_1.sql with this complete content:\n\n// routes/api.js - API Endpoints using Express.js\nconst express = require('express');\nconst router = new express.Router();\n\nrouter.post('/conversation', async (req, res) => {\n  // Logic to create a conversation record and handle user authentication if needed\n});\n\nrouter.get('/conversation/:convID', async (req, res) => {\n  // Retrieve specific conversation's data based on ConvoID for context maintenance during interactions\n});\n\nrouter.put('/message/:msgID', async (req, res) => {\n  // Update message content within an ongoing conversation using the NLU results or new information provided by user input\n});\n\n// Future Stripe integration placeholder endpoint\nrouter.post('/payment-intent', async (req, res) => {\n  // Placeholder logic for payment flow initiation tied to future Stripe gateway setup and linked with backend processes\n});\n\nmodule.exports = router;\n\nThis is for opportunity: Customized AI Chatbot Development\nMake sure the file is complete, working, and production-ready.",
  "severity": 6,
  "risks": [
    "Slow failure: unnoticed degradation accumulating by 2028-01-01",
    "Unintended consequence: incentives shift toward short-term metrics, long-term reliability decays",
    "Incentive drift: stakeholders habituate to optimistic outputs, raising risk of silent defects"
  ],
  "mitigations": [
    "Add scheduled adversarial audits with hard pass/fail gates",
    "Track leading indicators for drift and trust inflation; alert on trend change",
    "Prefer reversible rollouts; keep rollback artifacts warm and tested"
  ],
  "block_execution": false
}