{
  "id": "fsar_e8df1d7a-2aed-4d10-8bd7-0e575120b6ae",
  "timestamp": "2026-01-01T12:31:05.778Z",
  "proposal": "idea_implementation: Create or update the file routes/api/v1/sales.js with this complete content:\n\nconst express = require('express');\nconst router = express.Router();\nrouter.get('/', async (req, res) => {\n    try {\n        const salesData = await SalesService.listAllSalesWithDetails(req); // Placeholder for actual implementation\n        return res.json(salesData);\n    } catch (error) {\n        console0:res.status(500).send('Internal Server Error');\n    }\n});\nmodule.exports = router;\n\nThis is for opportunity: Stripe Funnel Optimization\nMake sure the file is complete, working, and production-ready.",
  "severity": 6,
  "risks": [
    "Slow failure: unnoticed degradation accumulating by 2028-01-01",
    "Unintended consequence: incentives shift toward short-term metrics, long-term reliability decays",
    "Incentive drift: stakeholders habituate to optimistic outputs, raising risk of silent defects"
  ],
  "mitigations": [
    "Add scheduled adversarial audits with hard pass/fail gates",
    "Track leading indicators for drift and trust inflation; alert on trend change",
    "Prefer reversible rollouts; keep rollback artifacts warm and tested"
  ],
  "block_execution": false
}