{
  "id": "fsar_2a270e9f-2dad-4733-97aa-b087bbc89236",
  "timestamp": "2026-01-01T04:15:51.640Z",
  "proposal": "idea_implementation: Create or update the file generated_3.js with this complete content:\n\nconst express = require('express');\nconst router = new express.Router();\n// Assuming that User model is already set up in models folder and imported appropriately \nrouter.post('/users', async (req, res) => {\n    // Fetch user data from the database using Sequelize ORM to populate personalized suggestions  \n});\n\nThis is for opportunity: Stripe + Online Funnel Optimization\nMake sure the file is complete, working, and production-ready.",
  "severity": 6,
  "risks": [
    "Slow failure: unnoticed degradation accumulating by 2027-12-31",
    "Unintended consequence: incentives shift toward short-term metrics, long-term reliability decays",
    "Incentive drift: stakeholders habituate to optimistic outputs, raising risk of silent defects"
  ],
  "mitigations": [
    "Add scheduled adversarial audits with hard pass/fail gates",
    "Track leading indicators for drift and trust inflation; alert on trend change",
    "Prefer reversible rollouts; keep rollback artifacts warm and tested"
  ],
  "block_execution": false
}