{
  "id": "fsar_a1736d3e-f76d-4170-a07b-b2de5ada36e9",
  "timestamp": "2026-01-02T05:01:32.149Z",
  "proposal": "idea_implementation: Create or update the file src/components/Dashboard.js with this complete content:\n\nimport React from 'react';\n// ... other imports...\nfunction Dashboard() {\n    // Component logic and JSX here, e.g., map through tasks or teams assigned to a user etc. \n}\nexport default Dashboard;\n\nThis is for opportunity: Remote Team Management Software\nMake sure the file is complete, working, and production-ready.",
  "severity": 6,
  "risks": [
    "Slow failure: unnoticed degradation accumulating by 2028-01-01",
    "Unintended consequence: incentives shift toward short-term metrics, long-term reliability decays",
    "Incentive drift: stakeholders habituate to optimistic outputs, raising risk of silent defects"
  ],
  "mitigations": [
    "Add scheduled adversarial audits with hard pass/fail gates",
    "Track leading indicators for drift and trust inflation; alert on trend change",
    "Prefer reversible rollouts; keep rollback artifacts warm and tested"
  ],
  "block_execution": false
}