{
  "id": "fsar_6f48613f-467e-4e42-865b-0004f1482b67",
  "timestamp": "2026-01-02T01:11:47.364Z",
  "proposal": "idea_implementation: Create or update the file routes/api.js with this complete content:\n\n// ... existing code from above...\nrouter.post('/complete_purchase', async (req, res) => {\n    // logic to finalize a purchase and log the details in 'purchases' table after Stripe payment confirmation\n});\n\nThis is for opportunity: Game Overlay Distribution\nMake sure the file is complete, working, and production-ready.",
  "severity": 6,
  "risks": [
    "Slow failure: unnoticed degradation accumulating by 2028-01-01",
    "Unintended consequence: incentives shift toward short-term metrics, long-term reliability decays",
    "Incentive drift: stakeholders habituate to optimistic outputs, raising risk of silent defects"
  ],
  "mitigations": [
    "Add scheduled adversarial audits with hard pass/fail gates",
    "Track leading indicators for drift and trust inflation; alert on trend change",
    "Prefer reversible rollouts; keep rollback artifacts warm and tested"
  ],
  "block_execution": false
}