{
  "id": "fsar_e83358fa-7552-4e6f-929f-95aae20cf2ba",
  "timestamp": "2026-01-01T05:28:15.744Z",
  "proposal": "idea_implementation: Create or update the file generated_4.js with this complete content:\n\n// controllers/orderController.js \nconst { createOrder } = require('../models'); // Assumes this function handles order creation with Stripe integration if needed.\nmodule.exports = {\n    createOrder,\n};\n\nThis is for opportunity: Make.com Scenario Design\nMake sure the file is complete, working, and production-ready.",
  "severity": 6,
  "risks": [
    "Slow failure: unnoticed degradation accumulating by 2027-12-31",
    "Unintended consequence: incentives shift toward short-term metrics, long-term reliability decays",
    "Incentive drift: stakeholders habituate to optimistic outputs, raising risk of silent defects"
  ],
  "mitigations": [
    "Add scheduled adversarial audits with hard pass/fail gates",
    "Track leading indicators for drift and trust inflation; alert on trend change",
    "Prefer reversible rollouts; keep rollback artifacts warm and tested"
  ],
  "block_execution": false
}