{
  "id": "fsar_4504b05b-f82b-45e5-bc1d-429aacf14d6b",
  "timestamp": "2026-01-01T09:12:49.579Z",
  "proposal": "idea_implementation: Create or update the file migrations/create-customers-table.sql with this complete content:\n\nCREATE TABLE IF NOT EXISTS Customers (\n    customer_id SERIAL PRIMARY KEY,\n    name VARCHAR(256) NOT NULL UNIQUE,\n    email VARCHAR(100) NOT NULL UNIQUE CHECK (email LIKE '%@%.%' AND LENGTH(REGEXP_REPLACE(email, '@', '', 'g')) > 4), // Simplified regex for validating emails. Not fully compliant with RFC standards but serves as a basic checker\n    createdAt TIMESTAMP NOT NULL DEFAULT NOW()\n);\n\nThis is for opportunity: AI-Driven Marketing Services\nMake sure the file is complete, working, and production-ready.",
  "severity": 6,
  "risks": [
    "Slow failure: unnoticed degradation accumulating by 2028-01-01",
    "Unintended consequence: incentives shift toward short-term metrics, long-term reliability decays",
    "Incentive drift: stakeholders habituate to optimistic outputs, raising risk of silent defects"
  ],
  "mitigations": [
    "Add scheduled adversarial audits with hard pass/fail gates",
    "Track leading indicators for drift and trust inflation; alert on trend change",
    "Prefer reversible rollouts; keep rollback artifacts warm and tested"
  ],
  "block_execution": false
}