{
  "id": "fsar_a26e6dc0-a336-49c1-b7ac-fd7144a25726",
  "timestamp": "2026-01-02T04:44:43.564Z",
  "proposal": "idea_implementation: Create or update the file generated_2.sql with this complete content:\n\n-- Initial migration script to create the SaaS clone tables if they do not exist yet\nCREATE TABLE IF NOT EXISTS `cloned_saas_applications` (\n    id SERIAL PRIMARY KEY,\n    name VARCHAR(255) UNIQUE NOT NULL,\n    description TEXT NOT NULL,\n    -- Other necessary fields like user permissions etc. here...\n);\n\nThis is for opportunity: SaaS Cloning and Optimization\nMake sure the file is complete, working, and production-ready.",
  "severity": 6,
  "risks": [
    "Slow failure: unnoticed degradation accumulating by 2028-01-01",
    "Unintended consequence: incentives shift toward short-term metrics, long-term reliability decays",
    "Incentive drift: stakeholders habituate to optimistic outputs, raising risk of silent defects"
  ],
  "mitigations": [
    "Add scheduled adversarial audits with hard pass/fail gates",
    "Track leading indicators for drift and trust inflation; alert on trend change",
    "Prefer reversible rollouts; keep rollback artifacts warm and tested"
  ],
  "block_execution": false
}