{
  "id": "fsar_1f5c14bb-da5a-4fb9-8d15-bfe8e938c9a1",
  "timestamp": "2025-12-31T23:34:33.269Z",
  "proposal": "idea_implementation: Create or update the file routes/api.js with this complete content:\n\nconst express = require('express');\nconst router = new express.Router();\n// Import other necessary modules and services here (e.g., database connection, ai_model)\nrouter.get('/customers', async (req, res) => {\n  try {\n    const customers = await getCustomersFromDatabase(req); // Function to retrieve customer info from Neon PostgreSQL DB\n    res.json(customers);\n  } catch (error) {\n    console.error('Error retrieving custom users: ', error);\n    res.status(500).send('Internal Server Error');\n  }\n});\n// Other routes for POST /api/orders, GET /api/insights etc., will be added here with their respective logic to handle CRON jobs and Stripe integration via gRPC calls or REST API as needed.\n\nThis is for opportunity: Custom AI Models for Businesses\nMake sure the file is complete, working, and production-ready.",
  "severity": 6,
  "risks": [
    "Slow failure: unnoticed degradation accumulating by 2027-12-31",
    "Unintended consequence: incentives shift toward short-term metrics, long-term reliability decays",
    "Incentive drift: stakeholders habituate to optimistic outputs, raising risk of silent defects"
  ],
  "mitigations": [
    "Add scheduled adversarial audits with hard pass/fail gates",
    "Track leading indicators for drift and trust inflation; alert on trend change",
    "Prefer reversible rollouts; keep rollback artifacts warm and tested"
  ],
  "block_execution": false
}