{
  "id": "fsar_42aa5849-0706-4f9d-8b97-bb0aadcd8cb5",
  "timestamp": "2026-01-01T10:11:49.702Z",
  "proposal": "idea_implementation: Create or update the file generated_1.sql with this complete content:\n\n===FILE:migrations/001_create_users_table.sql===\nCREATE TABLE IF NOT EXISTS users (\n    id SERIAL PRIMARY KEY,\n    username VARCHAR(50) UNIQUE NOT NULL,\n    email VARCHAR(255) NOT NULL UNIQUE\n);\n\nThis is for opportunity: AI-Driven Business Analytics\nMake sure the file is complete, working, and production-ready.",
  "severity": 6,
  "risks": [
    "Slow failure: unnoticed degradation accumulating by 2028-01-01",
    "Unintended consequence: incentives shift toward short-term metrics, long-term reliability decays",
    "Incentive drift: stakeholders habituate to optimistic outputs, raising risk of silent defects"
  ],
  "mitigations": [
    "Add scheduled adversarial audits with hard pass/fail gates",
    "Track leading indicators for drift and trust inflation; alert on trend change",
    "Prefer reversible rollouts; keep rollback artifacts warm and tested"
  ],
  "block_execution": false
}